{
  "benchmark_id": "AFFORD-Bench",
  "benchmark_version": "1.0.0",
  "track": "lite",
  "protocol": {
    "arms": [
      "control",
      "intervention"
    ],
    "scoring_track": "compliant_dynamic_completion",
    "safety_constraints": {
      "max_contact_force_n": 150.0,
      "joint_torque_limits_nm": [
        87.0,
        87.0,
        87.0,
        87.0,
        12.0,
        12.0,
        12.0
      ]
    }
  },
  "cases": [
    {
      "case_id": "afford_d1_001_p0_+x",
      "domain_id": "D1",
      "domain_name": "Industrial Precision & Manufacturing",
      "task_id": "industrial_shaft_assembly",
      "task_number": 1,
      "policy_seed": 1010,
      "timing_bucket": "early",
      "scenario": {
        "scenario_id": "scen_afford_d1_001_p0_+x",
        "change_family": "SPATIAL_DISPLACEMENT",
        "change_type": "object_displacement",
        "trigger": {
          "trigger_type": "pre_grasp_proximity",
          "step": 15,
          "proximity_threshold_m": 0.1,
          "force_threshold_n": null
        },
        "intervention": {
          "direction": "+x",
          "offset_m": [
            0.03,
            0.0,
            0.0
          ],
          "impulse_velocity_mps": null
        },
        "safety_thresholds": {
          "max_safe_force_n": 150.0,
          "enforce_torque_limits": true
        }
      }
    },
    {
      "case_id": "afford_d1_001_p1_-x",
      "domain_id": "D1",
      "domain_name": "Industrial Precision & Manufacturing",
      "task_id": "industrial_shaft_assembly",
      "task_number": 1,
      "policy_seed": 1011,
      "timing_bucket": "middle",
      "scenario": {
        "scenario_id": "scen_afford_d1_001_p1_-x",
        "change_family": "SPATIAL_DISPLACEMENT",
        "change_type": "object_displacement",
        "trigger": {
          "trigger_type": "pre_grasp_proximity",
          "step": 25,
          "proximity_threshold_m": 0.08,
          "force_threshold_n": null
        },
        "intervention": {
          "direction": "-x",
          "offset_m": [
            -0.03,
            0.0,
            0.0
          ],
          "impulse_velocity_mps": null
        },
        "safety_thresholds": {
          "max_safe_force_n": 150.0,
          "enforce_torque_limits": true
        }
      }
    },
    {
      "case_id": "afford_d1_001_p2_+y",
      "domain_id": "D1",
      "domain_name": "Industrial Precision & Manufacturing",
      "task_id": "industrial_shaft_assembly",
      "task_number": 1,
      "policy_seed": 1012,
      "timing_bucket": "late",
      "scenario": {
        "scenario_id": "scen_afford_d1_001_p2_+y",
        "change_family": "SPATIAL_DISPLACEMENT",
        "change_type": "object_displacement",
        "trigger": {
          "trigger_type": "pre_grasp_proximity",
          "step": 35,
          "proximity_threshold_m": 0.05,
          "force_threshold_n": null
        },
        "intervention": {
          "direction": "+y",
          "offset_m": [
            0.0,
            0.03,
            0.0
          ],
          "impulse_velocity_mps": null
        },
        "safety_thresholds": {
          "max_safe_force_n": 150.0,
          "enforce_torque_limits": true
        }
      }
    },
    {
      "case_id": "afford_d1_001_p3_-y",
      "domain_id": "D1",
      "domain_name": "Industrial Precision & Manufacturing",
      "task_id": "industrial_shaft_assembly",
      "task_number": 1,
      "policy_seed": 1013,
      "timing_bucket": "middle",
      "scenario": {
        "scenario_id": "scen_afford_d1_001_p3_-y",
        "change_family": "SPATIAL_DISPLACEMENT",
        "change_type": "object_displacement",
        "trigger": {
          "trigger_type": "pre_grasp_proximity",
          "step": 25,
          "proximity_threshold_m": 0.08,
          "force_threshold_n": null
        },
        "intervention": {
          "direction": "-y",
          "offset_m": [
            0.0,
            -0.03,
            0.0
          ],
          "impulse_velocity_mps": null
        },
        "safety_thresholds": {
          "max_safe_force_n": 150.0,
          "enforce_torque_limits": true
        }
      }
    },
    {
      "case_id": "afford_d1_002_p0_+x",
      "domain_id": "D1",
      "domain_name": "Industrial Precision & Manufacturing",
      "task_id": "industrial_gear_mesh",
      "task_number": 2,
      "policy_seed": 1020,
      "timing_bucket": "early",
      "scenario": {
        "scenario_id": "scen_afford_d1_002_p0_+x",
        "change_family": "SPATIAL_DISPLACEMENT",
        "change_type": "object_displacement",
        "trigger": {
          "trigger_type": "pre_grasp_proximity",
          "step": 15,
          "proximity_threshold_m": 0.1,
          "force_threshold_n": null
        },
        "intervention": {
          "direction": "+x",
          "offset_m": [
            0.03,
            0.0,
            0.0
          ],
          "impulse_velocity_mps": null
        },
        "safety_thresholds": {
          "max_safe_force_n": 150.0,
          "enforce_torque_limits": true
        }
      }
    },
    {
      "case_id": "afford_d1_002_p1_-x",
      "domain_id": "D1",
      "domain_name": "Industrial Precision & Manufacturing",
      "task_id": "industrial_gear_mesh",
      "task_number": 2,
      "policy_seed": 1021,
      "timing_bucket": "middle",
      "scenario": {
        "scenario_id": "scen_afford_d1_002_p1_-x",
        "change_family": "SPATIAL_DISPLACEMENT",
        "change_type": "object_displacement",
        "trigger": {
          "trigger_type": "pre_grasp_proximity",
          "step": 25,
          "proximity_threshold_m": 0.08,
          "force_threshold_n": null
        },
        "intervention": {
          "direction": "-x",
          "offset_m": [
            -0.03,
            0.0,
            0.0
          ],
          "impulse_velocity_mps": null
        },
        "safety_thresholds": {
          "max_safe_force_n": 150.0,
          "enforce_torque_limits": true
        }
      }
    },
    {
      "case_id": "afford_d1_002_p2_+y",
      "domain_id": "D1",
      "domain_name": "Industrial Precision & Manufacturing",
      "task_id": "industrial_gear_mesh",
      "task_number": 2,
      "policy_seed": 1022,
      "timing_bucket": "late",
      "scenario": {
        "scenario_id": "scen_afford_d1_002_p2_+y",
        "change_family": "SPATIAL_DISPLACEMENT",
        "change_type": "object_displacement",
        "trigger": {
          "trigger_type": "pre_grasp_proximity",
          "step": 35,
          "proximity_threshold_m": 0.05,
          "force_threshold_n": null
        },
        "intervention": {
          "direction": "+y",
          "offset_m": [
            0.0,
            0.03,
            0.0
          ],
          "impulse_velocity_mps": null
        },
        "safety_thresholds": {
          "max_safe_force_n": 150.0,
          "enforce_torque_limits": true
        }
      }
    },
    {
      "case_id": "afford_d1_002_p3_-y",
      "domain_id": "D1",
      "domain_name": "Industrial Precision & Manufacturing",
      "task_id": "industrial_gear_mesh",
      "task_number": 2,
      "policy_seed": 1023,
      "timing_bucket": "middle",
      "scenario": {
        "scenario_id": "scen_afford_d1_002_p3_-y",
        "change_family": "SPATIAL_DISPLACEMENT",
        "change_type": "object_displacement",
        "trigger": {
          "trigger_type": "pre_grasp_proximity",
          "step": 25,
          "proximity_threshold_m": 0.08,
          "force_threshold_n": null
        },
        "intervention": {
          "direction": "-y",
          "offset_m": [
            0.0,
            -0.03,
            0.0
          ],
          "impulse_velocity_mps": null
        },
        "safety_thresholds": {
          "max_safe_force_n": 150.0,
          "enforce_torque_limits": true
        }
      }
    },
    {
      "case_id": "afford_d1_003_p0_+x",
      "domain_id": "D1",
      "domain_name": "Industrial Precision & Manufacturing",
      "task_id": "industrial_pin_insertion",
      "task_number": 3,
      "policy_seed": 1030,
      "timing_bucket": "early",
      "scenario": {
        "scenario_id": "scen_afford_d1_003_p0_+x",
        "change_family": "SPATIAL_DISPLACEMENT",
        "change_type": "object_displacement",
        "trigger": {
          "trigger_type": "pre_grasp_proximity",
          "step": 15,
          "proximity_threshold_m": 0.1,
          "force_threshold_n": null
        },
        "intervention": {
          "direction": "+x",
          "offset_m": [
            0.03,
            0.0,
            0.0
          ],
          "impulse_velocity_mps": null
        },
        "safety_thresholds": {
          "max_safe_force_n": 150.0,
          "enforce_torque_limits": true
        }
      }
    },
    {
      "case_id": "afford_d1_003_p1_-x",
      "domain_id": "D1",
      "domain_name": "Industrial Precision & Manufacturing",
      "task_id": "industrial_pin_insertion",
      "task_number": 3,
      "policy_seed": 1031,
      "timing_bucket": "middle",
      "scenario": {
        "scenario_id": "scen_afford_d1_003_p1_-x",
        "change_family": "SPATIAL_DISPLACEMENT",
        "change_type": "object_displacement",
        "trigger": {
          "trigger_type": "pre_grasp_proximity",
          "step": 25,
          "proximity_threshold_m": 0.08,
          "force_threshold_n": null
        },
        "intervention": {
          "direction": "-x",
          "offset_m": [
            -0.03,
            0.0,
            0.0
          ],
          "impulse_velocity_mps": null
        },
        "safety_thresholds": {
          "max_safe_force_n": 150.0,
          "enforce_torque_limits": true
        }
      }
    },
    {
      "case_id": "afford_d1_003_p2_+y",
      "domain_id": "D1",
      "domain_name": "Industrial Precision & Manufacturing",
      "task_id": "industrial_pin_insertion",
      "task_number": 3,
      "policy_seed": 1032,